model_comparison.csv

ML Model,Accuracy,AUC,Precision,Recall,F1 Score,MCC,Training Time (sec)
Decision Tree,0.9714,0.9717,0.9585,0.6929,0.8044,0.8015,0.21942710876464844
Logistic Regression,0.961,0.9617,0.8692,0.6371,0.7352,0.7248,0.1082758903503418
SVM,0.9634,0.8866,0.9672,0.5894,0.7325,0.7394,517.108060836792
KNN,0.9578,0.9045,0.9289,0.5453,0.6872,0.6934,0.03092670440673828
Random Forest,0.9232,0.9724,0.5295,0.8718,0.6588,0.6429,0.9416830539703369
Naive Bayes,0.6145,0.8901,0.1736,0.94,0.293,0.2933,0.06399416923522949

README.md

## Decision Tree

The Decision Tree model achieved an accuracy of 97.14%, AUC of 97.17%, precision of 95.85%, recall of 69.29%, F1 score of 80.44% and MCC of 0.8015.